[
  {
    "id": "css-button",
    "kind": "css-component",
    "classPrefix": "velin-btn",
    "category": "actions",
    "subcategory": "button",
    "purpose": "Primary interactive control for actions and form submit.",
    "family": "actions",
    "maturity": "core",
    "recommendedPages": [
      "landing",
      "saas",
      "dashboard",
      "shop"
    ],
    "recommendedSections": [
      "hero",
      "cta",
      "contact",
      "pricing"
    ],
    "compatibleWith": [
      "css-card",
      "css-input",
      "velin-form-summary"
    ],
    "incompatibleWith": [],
    "accessibility": {
      "role": "native button/link",
      "keyboard": "Enter/Space on button"
    },
    "seo": {
      "impact": "low",
      "notes": "CTA copy affects conversion, not crawl structure"
    },
    "performance": {
      "cost": "css-only"
    },
    "variants": [
      "primary",
      "secondary",
      "ghost",
      "danger",
      "sm",
      "lg"
    ],
    "density": [
      "comfortable",
      "default",
      "compact"
    ],
    "themeSupport": [
      "light",
      "dark",
      "system"
    ],
    "motion": {
      "hover": true,
      "reducedMotionSafe": true
    },
    "examples": [
      "<button class=\"velin-btn velin-btn--primary\">Save</button>"
    ],
    "promptKeywords": [
      "button",
      "cta",
      "call to action",
      "submit"
    ],
    "designIntelligence": {
      "visualWeight": 4,
      "importance": "primary",
      "hierarchy": "action",
      "spacingRules": [
        "pair with gap-3 or gap-4 in CTA groups"
      ],
      "typographyRules": [
        "label ≤ 3 words preferred"
      ],
      "animationRules": [
        "no infinite pulse on primary CTA"
      ],
      "colorRules": [
        "primary uses --velin-color-primary + on-primary text"
      ],
      "eyeFlow": "place primary CTA after supporting copy",
      "compositionRules": [
        "max 2 CTAs in hero"
      ],
      "commonMistakes": [
        "three equal CTAs",
        "low contrast ghost on muted"
      ],
      "bestPractices": [
        "one primary + optional secondary"
      ]
    }
  },
  {
    "id": "css-card",
    "kind": "css-component",
    "classPrefix": "velin-card",
    "category": "content",
    "subcategory": "card",
    "purpose": "Grouped content surface for features, services, pricing tiers.",
    "family": "surfaces",
    "maturity": "core",
    "recommendedPages": [
      "landing",
      "saas",
      "agency",
      "portfolio"
    ],
    "recommendedSections": [
      "services",
      "benefits",
      "pricing"
    ],
    "compatibleWith": [
      "css-button",
      "css-badge",
      "velin-icon"
    ],
    "incompatibleWith": [],
    "accessibility": {
      "notes": "Heading inside card; don't nest interactive without care"
    },
    "seo": {
      "impact": "medium",
      "notes": "Card headings help section semantics"
    },
    "performance": {
      "cost": "css-only"
    },
    "variants": [
      "raised",
      "bordered"
    ],
    "density": [
      "comfortable",
      "default",
      "compact"
    ],
    "themeSupport": [
      "light",
      "dark"
    ],
    "motion": {
      "reducedMotionSafe": true
    },
    "examples": [
      "<article class=\"velin-card\">…</article>"
    ],
    "promptKeywords": [
      "card",
      "feature",
      "service",
      "tile"
    ],
    "designIntelligence": {
      "visualWeight": 3,
      "importance": "secondary",
      "hierarchy": "section-item",
      "spacingRules": [
        "grid gap-4 or gap-6"
      ],
      "typographyRules": [
        "H3 title + short body"
      ],
      "animationRules": [
        "optional entrance; respect reduced motion"
      ],
      "colorRules": [
        "raised surface + text tokens"
      ],
      "eyeFlow": "scan titles across grid first",
      "compositionRules": [
        "2–4 columns desktop; 1 mobile"
      ],
      "commonMistakes": [
        "uneven card heights with sparse content",
        "too many cards above fold"
      ],
      "bestPractices": [
        "equal structure: icon, title, text, optional link"
      ]
    }
  },
  {
    "id": "css-input",
    "kind": "css-component",
    "classPrefix": "velin-input",
    "category": "forms",
    "subcategory": "field",
    "purpose": "Text entry fields with labels for forms.",
    "family": "forms",
    "maturity": "core",
    "recommendedPages": [
      "landing",
      "saas",
      "dashboard",
      "shop"
    ],
    "recommendedSections": [
      "contact",
      "login"
    ],
    "compatibleWith": [
      "velin-form-summary",
      "css-button"
    ],
    "incompatibleWith": [],
    "accessibility": {
      "notes": "Visible label required; wire aria-invalid via form-summary"
    },
    "seo": {
      "impact": "low"
    },
    "performance": {
      "cost": "css-only"
    },
    "variants": [
      "default",
      "invalid"
    ],
    "density": [
      "default",
      "compact",
      "data-dense"
    ],
    "themeSupport": [
      "light",
      "dark"
    ],
    "motion": {},
    "examples": [
      "<label>Name<input class=\"velin-input\"></label>"
    ],
    "promptKeywords": [
      "input",
      "form field",
      "text field"
    ],
    "designIntelligence": {
      "visualWeight": 2,
      "importance": "primary",
      "hierarchy": "form-control",
      "spacingRules": [
        "stack fields with gap-4"
      ],
      "typographyRules": [
        "label above field"
      ],
      "animationRules": [],
      "colorRules": [
        "invalid uses danger tokens"
      ],
      "eyeFlow": "label → field → help → errors summary",
      "compositionRules": [
        "group related fields"
      ],
      "commonMistakes": [
        "placeholder-only labels"
      ],
      "bestPractices": [
        "pair with velin-form-summary"
      ]
    }
  },
  {
    "id": "css-alert",
    "kind": "css-component",
    "classPrefix": "velin-alert",
    "category": "feedback",
    "subcategory": "alert",
    "purpose": "Inline status messages.",
    "family": "feedback",
    "maturity": "core",
    "recommendedPages": [
      "dashboard",
      "saas",
      "docs"
    ],
    "recommendedSections": [
      "contact",
      "onboarding"
    ],
    "compatibleWith": [
      "velin-form-summary"
    ],
    "incompatibleWith": [],
    "accessibility": {
      "role": "status/alert depending on urgency"
    },
    "seo": {
      "impact": "none"
    },
    "performance": {
      "cost": "css-only"
    },
    "variants": [
      "info",
      "success",
      "warning",
      "danger"
    ],
    "density": [
      "default",
      "compact"
    ],
    "themeSupport": [
      "light",
      "dark"
    ],
    "motion": {},
    "examples": [
      "<div class=\"velin-alert velin-alert--info\">…</div>"
    ],
    "promptKeywords": [
      "alert",
      "banner",
      "notice"
    ],
    "designIntelligence": {
      "visualWeight": 3,
      "importance": "secondary",
      "hierarchy": "feedback",
      "spacingRules": [
        "margin-block before forms"
      ],
      "typographyRules": [
        "concise message"
      ],
      "animationRules": [],
      "colorRules": [
        "semantic status tokens"
      ],
      "eyeFlow": "near the related control",
      "compositionRules": [
        "one alert per concern"
      ],
      "commonMistakes": [
        "using alert for marketing hero"
      ],
      "bestPractices": [
        "pair with actionable next step"
      ]
    }
  },
  {
    "id": "css-nav",
    "kind": "css-component",
    "classPrefix": "velin-nav",
    "category": "navigation",
    "subcategory": "nav",
    "purpose": "Site or app navigation chrome.",
    "family": "navigation",
    "maturity": "core",
    "recommendedPages": [
      "landing",
      "corporate",
      "docs",
      "dashboard"
    ],
    "recommendedSections": [
      "navbar"
    ],
    "compatibleWith": [
      "velin-theme-toggle",
      "velin-search"
    ],
    "incompatibleWith": [],
    "accessibility": {
      "notes": "Landmark nav; skip link on pages"
    },
    "seo": {
      "impact": "high",
      "notes": "Primary internal links"
    },
    "performance": {
      "cost": "css-only"
    },
    "variants": [
      "header",
      "pills"
    ],
    "density": [
      "comfortable",
      "default",
      "compact"
    ],
    "themeSupport": [
      "light",
      "dark"
    ],
    "motion": {},
    "examples": [
      "<nav class=\"velin-nav\">…</nav>"
    ],
    "promptKeywords": [
      "navbar",
      "navigation",
      "header menu"
    ],
    "designIntelligence": {
      "visualWeight": 3,
      "importance": "primary",
      "hierarchy": "chrome",
      "spacingRules": [
        "sticky optional; padding-inline token"
      ],
      "typographyRules": [
        "short labels"
      ],
      "animationRules": [],
      "colorRules": [
        "base or raised surface"
      ],
      "eyeFlow": "logo → links → CTA",
      "compositionRules": [
        "one primary nav CTA max"
      ],
      "commonMistakes": [
        "too many top-level items"
      ],
      "bestPractices": [
        "5–7 primary links"
      ]
    }
  },
  {
    "id": "velin-modal",
    "kind": "web-component",
    "tag": "velin-modal",
    "category": "overlays",
    "subcategory": "modal",
    "purpose": "Blocking dialog overlay for focused tasks.",
    "family": "overlays",
    "maturity": "core",
    "recommendedPages": [
      "saas",
      "dashboard",
      "shop"
    ],
    "recommendedSections": [],
    "compatibleWith": [
      "css-button",
      "velin-form-summary"
    ],
    "incompatibleWith": [
      "velin-drawer",
      "velin-sheet"
    ],
    "accessibility": {
      "focusTrap": true,
      "escapeCloses": true,
      "inertBackground": true
    },
    "seo": {
      "impact": "none",
      "notes": "Do not put primary SEO content only in modal"
    },
    "performance": {
      "cost": "lazy-ok"
    },